Titre,Image
"Titre: Le CETA « pourrait » s’appliquer même si l’Assemblée le rejette, estime Valérie Hayer",Image: https://img.lemde.fr/2024/03/12/0/0/8640/5760/110/73/60/0/facbedb_807c897ecfad46c88d5b94f89c4a5e74-0-54b5740cbcf141e1a97b1a39738d7392.jpg
"Titre: Donald Trump attendu au tribunal pour une caution de près d’un demi-milliard de dollars, avec le risque de voir ses comptes gelés",Image: https://img.lemde.fr/2024/03/25/0/0/5088/3392/110/73/60/0/a4efd21_2024-03-25t014805z-1470929090-rc2os6aldcc6-rtrmadp-3-usa-trump.JPG
Titre: François Rebsamen remet sur la table la question de la séparation entre la Bourgogne et la Franche-Comté,Image: https://img.lemde.fr/2024/03/25/0/0/7521/5014/110/73/60/0/4a80510_1711355252606-000-327687d.jpg
"Titre: Péter Eötvös, compositeur et chef d’orchestre hongrois, est mort",Image: https://img.lemde.fr/2024/03/25/439/0/2910/1940/110/73/60/0/88a1728_1711359192390-maxpeoplefrfour905520.jpg
"Titre: Le PDG de Boeing, Dave Calhoun, quitte l’entreprise",Image: https://img.lemde.fr/2024/03/25/0/0/4200/2800/110/73/60/0/09e6449_2024-03-25t121900z-834910315-rc2x1z9rpf5n-rtrmadp-3-boeing-ceo.JPG
"Titre: Les derniers éléphants de Côte d’Ivoire, adulés mais mal protégés",Image: https://img.lemde.fr/2024/03/23/114/0/4808/3205/110/73/60/0/c2a212d_1711186631036-pal0109041.jpg
"Titre: Attentat près de Moscou : la branche de l’EI « impliquée » avait mené « plusieurs tentatives » en France, dit Emmanuel Macron",Image: https://img.lemde.fr/2024/03/25/1/0/8029/5352/110/73/60/0/f02d374_5016363-01-06.jpg
Titre: Plusieurs établissements scolaires visés par des menaces d’attentats dans l’académie de Reims entre dimanche et lundi,Image: https://img.lemde.fr/2024/03/20/0/0/6371/4247/110/73/60/0/1b75652_2024-03-20t122329z-1627642338-rc2op6afim56-rtrmadp-3-france-politics.JPG
Titre: Une décision de justice ordonne le blocage de Telegram en Espagne,Image: https://img.lemde.fr/2024/03/23/1/0/7402/4934/110/73/60/0/1d728d3_2024-03-23t101256z-500165514-rc2ufz92kxj2-rtrmadp-3-spain-court-telegram.JPG
Titre: Emmanuel Macron face aux élus qui demandent un statut d’autonomie pour la Guyane,Image: https://img.lemde.fr/2024/03/23/1/0/8192/5461/110/73/60/0/73f7654_5002930-01-06.jpg
Titre: Attentat près de Moscou : le Kremlin refuse de commenter la revendication de l’organisation Etat islamique tant que l’enquête est en cours,Image: https://img.lemde.fr/2024/03/23/0/0/6000/4000/110/73/60/0/b2b81f0_8d3d7c528dc54ceb8f7fa00a2b2e4c20-0-7d4a17020bc145d8bf26149be12fb690.jpg
Titre: Autoroute A69 : des écologistes perchés dans des arbres devant la Cour européenne des droits de l’homme,Image: https://img.lemde.fr/2024/03/18/1/0/8192/5461/110/73/60/0/1b7bcc5_5949030-01-06.jpg
"Titre: En direct, guerre en Ukraine : Volodymyr Zelensky dresse le bilan des attaques aériennes menées par la Russie au cours de la semaine dernière",Image: https://img.lemde.fr/2024/03/25/182/0/7649/5099/110/73/60/0/34a2c7a_1711366493737-raf-010.JPG
"Titre: Trafic de drogue : plusieurs nouvelles opérations « place nette XXL » lancées en France, « plus de 187 interpellations »",Image: https://img.lemde.fr/2024/03/25/0/0/7723/5149/110/73/60/0/257ed7c_5015303-01-06.jpg
"Titre: Attentat près de Moscou : des failles au sommet, un bouc émissaire à l’extérieur",Image: https://img.lemde.fr/2024/03/25/100/0/4912/3274/110/73/60/0/9ec6683_1711357614398-231516.jpg
Titre: Lutte contre les maltraitances et handicap : le gouvernement veut contrôler tous les établissements médico-sociaux accueillant des personnes handicapées,Image: https://img.lemde.fr/2024/03/19/0/23/8004/5336/110/73/60/0/8ed4759_5955505-01-06.jpg
Titre: Attentat près de Moscou : les quatre assaillants présumés ont été placés en détention provisoire,Image: https://img.lemde.fr/2024/03/24/0/0/3000/2000/110/73/60/0/955fbd5_8669a2febc804059b6bd0f270093242f-0-e3b3aa1f8806410597ffa101e135eb87.jpg
Titre: Le Sénégal sur la voie d’un séisme politique : l’opposant Bassirou Diomaye Faye donné en tête du premier tour de l’élection présidentielle,Image: https://img.lemde.fr/2024/03/25/0/0/4182/2788/110/73/60/0/9b27482_1711354330362-354955.jpg
Titre: Marie Mendras : « Croire à une adhésion massive des Russes à Poutine est une erreur »,Image: https://img.lemde.fr/2024/03/22/701/0/2002/1334/110/73/60/0/e98e337_1711107641629-marie-mendras-print.jpg
Titre: « L’amélioration de la résilience de l’Ukraine est essentielle » pour la présidente de la BERD,Image: https://img.lemde.fr/2024/03/23/0/0/5478/3652/110/73/60/0/ac2ec3b_1711190523869-000-34k97ph.jpg
"Titre: Près de Soumy, la police évacue les villages ukrainiens frontaliers de la Russie",Image: https://img.lemde.fr/2024/03/22/166/0/6986/4657/110/73/60/0/5465b6f_1711127113070-raf-021.JPG
Titre: Agriculture : un projet de loi remanié qui conforte le modèle productiviste,Image: https://img.lemde.fr/2024/03/24/0/0/6000/4000/110/73/60/0/c9478f7_1711303575829-337442.jpg
"Titre: Présidentielle au Sénégal : le candidat de l’opposition Bassirou Diomaye Faye donné largement en tête, le camp d’Amadou Ba se dit « certain » d’un second tour",Image: https://img.lemde.fr/2024/03/24/1/0/4000/2666/110/73/60/0/b18dfb4_5012369-01-06.jpg
"Titre: Au Brésil, au moins vingt-cinq morts dans une violente tempête et de fortes pluies",Image: https://img.lemde.fr/2024/03/24/0/300/3240/2160/110/73/60/0/83faa26_5009646-01-06.jpg
Titre: Le Royaume-Uni va annoncer de nouveaux investissements dans le nucléaire,Image: https://img.lemde.fr/2024/03/24/0/0/9000/6000/110/73/60/0/9a35c93_2024-03-24t145302z-397173871-rc2ds6akq70f-rtrmadp-3-britain-defence.JPG
Titre: Mexique : cinquante-huit personnes libérées sur les soixante-six enlevées à Culiacan,Image: https://img.lemde.fr/2024/03/23/0/93/1080/720/110/73/60/0/4faf4ca_1711155228136-vista-panorai-mica-de-culiacai-n.jpeg
Titre: A69 : des opposants au projet d’autoroute obtiennent un sursis pour le bois de la Crémade,Image: https://img.lemde.fr/2024/03/24/0/0/5389/3592/110/73/60/0/5669e1b_5009152-01-06.jpg
Titre: Elections européennes 2024 : le PS réuni derrière Raphaël Glucksmann pour son premier grand meeting,Image: https://img.lemde.fr/2024/03/24/297/0/5600/3733/110/73/60/0/a3f06a9_1711317376257-0z5a1497.jpg
Titre: Attentat près de Moscou : la France rehausse le plan Vigipirate au niveau « urgence attentat »,Image: https://img.lemde.fr/2024/03/23/0/0/3843/2562/110/73/60/0/cee77b0_5000084-01-06.jpg
"Titre: Sidaction 2024 : le montant des promesses de dons atteint 3,87 millions d’euros",Image: https://img.lemde.fr/2023/03/24/0/0/5427/3618/110/73/60/0/7cec7fc_5827870-01-06.jpg
Titre: Brésil : arrestation des commanditaires présumés de l’assassinat de Marielle Franco,Image: https://img.lemde.fr/2024/03/24/1/0/1657/1104/110/73/60/0/c44aede_5010710-01-06.jpg
"Titre: Face à sa montagne de dette, Patrick Drahi engage un jeu musclé avec ses prêteurs",Image: https://img.lemde.fr/2016/04/19/0/0/2200/1466/110/73/60/0/8cb8fcc_BTE078_FRANCE-BUSINESS-_0419_11.JPG
Titre: Le directeur de la rédaction de « La Provence » réintégré après sa mise à pied,Image: https://img.lemde.fr/2024/03/22/0/0/6693/4462/110/73/60/0/22921d2_1711106745565-000-322j84k.jpg
"Titre: Guerre Israël-Hamas, jour 170 : Emmanuel Macron réitère sa « ferme opposition » à une offensive israélienne sur Rafah",Image: https://img.lemde.fr/2024/03/24/1/0/8192/5461/110/73/60/0/743283a_5006524-01-06.jpg
"Titre: Attentat près de Moscou : l’Asie centrale, nouvelle tête de pont de l’organisation Etat islamique",Image: https://img.lemde.fr/2024/03/24/0/26/3547/2365/110/73/60/0/58ea3bf_1711295856040-hemis-2ggw99b.jpg
"Titre: En Irlande, Simon Harris désigné par son parti pour devenir premier ministre",Image: https://img.lemde.fr/2024/03/24/0/0/5731/3821/110/73/60/0/6828444_5009536-01-06.jpg
Titre: Alexis Lebrun remporte un haletant duel fratricide face à son frère Félix et conserve sa couronne de champion de France de tennis de table,Image: https://img.lemde.fr/2024/03/24/1/0/4500/3000/110/73/60/0/e966215_5009842-01-06.jpg
"Titre: Attentat près de Moscou, présidentielle au Sénégal, européennes… Les cinq infos à retenir du week-end",Image: https://img.lemde.fr/2024/03/24/0/0/1800/1200/110/73/60/0/3fe413d_1711299642050-fotojet-7.jpg
Titre: Haïti : la France affrète des hélicoptères pour évacuer ses ressortissants vulnérables,Image: https://img.lemde.fr/2024/03/05/0/0/5500/3666/110/73/60/0/aa5bb94_2024-03-05t004103z-1323880788-rc25f6agomzk-rtrmadp-3-haiti-violence.JPG
Titre: « React » sur Twitch : comment les internautes qui se filment en train de regarder la télé irritent les ayants droit,Image: https://img.lemde.fr/2024/03/21/0/0/4200/2800/110/73/60/0/57d19dc_1711029686294-twitch.jpg
"Titre: Le Guyana, jeune démocratie fragilisée par ses immenses réserves pétrolières",Image: https://img.lemde.fr/2024/03/21/0/0/5827/3885/110/73/60/0/e3922cd_1711033947001-guyana-2024-178.JPG
"Titre: Attentat près de Moscou : l’Ukraine accuse Vladimir Poutine de « mentir » quant à l’implication de Kiev dans l’attaque, les Etats-Unis affirment que la Russie n’a « aucune preuve »",Image: https://img.lemde.fr/2024/03/23/37/0/7568/5045/110/73/60/0/ac0e4a2_2024-03-23t170205z-1612333011-rc2sr6ajx09m-rtrmadp-3-russia-shooting.JPG
"Titre: Ski : privé d’un ultime duel par la météo, Cyprien Sarrazin ne ravit pas le globe de la descente à Marco Odermatt",Image: https://img.lemde.fr/2024/03/22/0/0/3360/2240/110/73/60/0/eb75653_5984155-01-06.jpg
"Titre: Mitra Hejazipour, championne d’échecs : « J’ai porté le voile à l’âge de 5 ans, au fil des années je n’en pouvais plus »",Image: https://img.lemde.fr/2024/03/22/46/0/2500/1666/110/73/60/0/d433755_1711101685260-isa0211986.jpg
Titre: Election présidentielle au Sénégal : les Sénégalais votent après des semaines d’incertitude,Image: https://img.lemde.fr/2024/03/24/0/0/5563/3709/110/73/60/0/7eb2dfa_8b432cd13c4141b2ba30059be568d37d-0-2b7806c91f9c4c759cbf3999b8e8b8c3.jpg
"Titre: Douglas Kennedy, écrivain : « Au bar, il m’arrive d’écrire sur le zinc »",Image: https://img.lemde.fr/2024/03/18/457/0/5493/3662/110/73/60/0/f68df18_1710775780023-img-8558-copie.jpg
Titre: Elections européennes : l’essayiste Malika Sorel-Sutter rejoint le Rassemblement national,Image: https://img.lemde.fr/2024/03/24/0/0/4504/3002/110/73/60/0/b3cd90f_1711280835804-sipa-00733414-000009.jpg
Titre: Belgique : des fusillades à Bruxelles font un mort et un blessé grave,Image: https://img.lemde.fr/2024/03/24/0/0/5695/3797/110/73/60/0/5ecc25a_1711277791002-000-32nb2fq.jpg
"Titre: Mondiaux de patinage artistique : après une remontée renversante, Adam Siao Him Fa décroche un bronze inattendu",Image: https://img.lemde.fr/2024/03/23/0/0/6082/4055/110/73/60/0/636e79e_5003012-01-06.jpg
"Titre: « Main invisible du marché », croissance… dernières croyances de l’Occident ?",Image: https://img.lemde.fr/2024/03/21/597/0/2551/1700/110/73/60/0/37f8d93_1711030570121-marchei-croyance.jpg
"Titre: Vainqueur à Melbourne, Carlos Sainz interrompt l’hégémonie Verstappen en formule 1",Image: https://img.lemde.fr/2024/03/24/0/0/5722/3815/110/73/60/0/415717d_5006428-01-06.jpg
Titre: Nathanaëlle Herbelin dialogue avec les nabis d’Orsay,Image: https://img.lemde.fr/2024/03/14/249/0/4393/2928/110/73/60/0/5aced97_1710412547545-10-ei-tre-ici-est-une-splendeur-1.jpg
"Titre: La « neuromanie », cette tendance à vouloir tout expliquer par le cerveau",Image: https://img.lemde.fr/2024/03/21/137/0/4045/2697/110/73/60/0/26e06bd_1711016699560-andia-andia-380363.JPG
"Titre: Au Nigeria, près de 140 élèves enlevés au début de mars par des hommes armés ont été libérés",Image: https://img.lemde.fr/2024/03/24/0/0/4200/2800/110/73/60/0/374310d_5006199-01-06.jpg
"Titre: Isabelle Jonveaux, sociologue : « Le jeûne spirituel répond à une saturation de la société de consommation »",Image: https://img.lemde.fr/2024/03/21/0/0/5472/3648/110/73/60/0/36209a1_1711043300354-000-34ly7na.jpg
Titre: Paris 2024 : « Les Ukrainiens ont gagné la bataille de la Seine »,Image: https://img.lemde.fr/2024/03/22/0/0/2110/1407/110/73/60/0/8e3fe17_1711129441807-000-9up7bp.jpg
"Titre: La liberté selon Jean Hélion, au Musée d’art moderne de Paris",Image: https://img.lemde.fr/2024/03/21/168/0/6307/4204/110/73/60/0/292cb1e_1711037307180-11.jpg
Titre: Elections européennes : Raphaël Glucksmann tente de s’immiscer dans le match entre Renaissance et le RN,Image: https://img.lemde.fr/2024/03/22/0/0/6000/4000/110/73/60/0/360316c_1711115080673-272874.jpg
"Titre: A Beaubourg, « La Muse endormie » de Brancusi se fait un nom",Image: https://img.lemde.fr/2024/03/18/137/0/945/630/110/73/60/0/848cca9_327293-3363965.jpg
Titre: Les Sénégalais face à un choix de société inédit lors de l’élection présidentielle,Image: https://img.lemde.fr/2024/03/23/1/0/4000/2666/110/73/60/0/183cbcd_1711180183929-275657.jpg
